{
 "clip_id": 19,
 "model": "faster-whisper large-v3",
 "language": "ru",
 "duration": 234.96,
 "segments": [
  {
   "start": 0.0,
   "end": 29.98,
   "text": "Девочка-пай"
  },
  {
   "start": 30.0,
   "end": 59.98,
   "text": "Девочка-пай"
  },
  {
   "start": 60.0,
   "end": 89.98,
   "text": "Девочка-пай"
  },
  {
   "start": 90.0,
   "end": 119.98,
   "text": "Девочка-пай"
  },
  {
   "start": 120.0,
   "end": 149.98,
   "text": "Девочка-пай"
  },
  {
   "start": 150.0,
   "end": 179.98,
   "text": "Девочка-пай"
  },
  {
   "start": 180.0,
   "end": 209.98,
   "text": "Девочка-пай"
  },
  {
   "start": 210.0,
   "end": 239.98,
   "text": "Девочка-пай"
  }
 ]
}