{
 "clip_id": 75,
 "model": "faster-whisper large-v3",
 "language": "ru",
 "duration": 30.07,
 "segments": [
  {
   "start": 0.0,
   "end": 3.54,
   "text": "В 2007-м не подворачивали Джеймса, мне кажется."
  },
  {
   "start": 20.54,
   "end": 26.83,
   "text": "Не отписывайтесь, нормально всё."
  },
  {
   "start": 27.73,
   "end": 29.35,
   "text": "Просто больше не спите никогда в жизни."
  }
 ]
}