{
 "clip_id": 84,
 "model": "faster-whisper large-v3",
 "language": "ru",
 "duration": 64.16,
 "segments": [
  {
   "start": 0.0,
   "end": 4.88,
   "text": "Забудьте про ваш обычный трактор. Сейчас будут монстры, которые грузят по 70 тонн за раз."
  },
  {
   "start": 5.1,
   "end": 9.4,
   "text": "Топ-3 самых огромных погрузчиков в мире. А в конце цена, от которой упадете."
  },
  {
   "start": 9.68,
   "end": 14.88,
   "text": "Третье место. Самый большой японский погрузчик КамАЦУ ВА-1206."
  },
  {
   "start": 15.02,
   "end": 19.22,
   "text": "Один из крупнейших карьерных погрузчиков в мире. Масса более 210 тонн."
  },
  {
   "start": 19.42,
   "end": 22.44,
   "text": "Такие машины встречаются только в самых больших карьерах мира."
  },
  {
   "start": 22.84,
   "end": 28.5,
   "text": "Они скорее исключение, чем правило. Цена за единицу этой техники достигает порядка 9 миллионов долларов."
  },
  {
   "start": 28.5,
   "end": 35.08,
   "text": "Второе место. Катарпиллар 994К. Создан для круглосуточной работы на рудниках и угольных разрезах."
  },
  {
   "start": 35.4,
   "end": 39.72,
   "text": "Такие машины выпускаются под крупные промышленные проекты. Это не массовая техника."
  },
  {
   "start": 40.08,
   "end": 44.58,
   "text": "Масса почти 240 тонн. А стоимость примерно 13 миллионов долларов."
  },
  {
   "start": 44.84,
   "end": 50.86,
   "text": "И первое место занимает самый крупный колесный фронтальный погрузчик. Массой 262 тонны."
  },
  {
   "start": 51.04,
   "end": 55.26,
   "text": "Работает он только в ультракрупных карьерах, где грузят сверхтоннажные самосвалы."
  },
  {
   "start": 55.26,
   "end": 57.0,
   "text": "Таких в мире считанные десятки."
  },
  {
   "start": 57.0,
   "end": 63.9,
   "text": "Это настоящая инженерная легенда. Литурна L2350. А стоит он около 11 миллионов долларов."
  },
  {
   "start": 63.9,
   "end": 73.9,
   "text": "Второе место. Катарпиллар 994К. Создан для круглосуточной работы на рудниках и угольных разрезах."
  },
  {
   "start": 73.9,
   "end": 83.9,
   "text": "Это настоящая инженерная легенда. Литурна L2350. А стоит он около 11 миллионов долларов."
  },
  {
   "start": 83.9,
   "end": 93.88,
   "text": "И первое место. Катарпиллар 994К. Создан для круглосуточной работы на рудниках и угольных разрезах."
  }
 ]
}