{
 "clip_id": 60,
 "model": "faster-whisper large-v3",
 "language": "ru",
 "duration": 20.58,
 "segments": [
  {
   "start": 0.02,
   "end": 20.48,
   "text": "В такмачке классно, минные поля, обломки дронов и кратеры, чья-то рука валяется в прицеле коллиматорном, ничто не сравнится с обещающими денег плакатами, в окопе холодновато и бензина, мягко говоря, маловато, зато 200 тысяч на карте и кент тоже 200, это из-за низколетящего дрона, жаль, что мы вместе записали обращение с этой прекрасной планеты и меня обнулят до ближайшего рассвета."
  }
 ]
}