{
 "clip_id": 2,
 "model": "faster-whisper large-v3",
 "language": "ru",
 "duration": 95.27,
 "segments": [
  {
   "start": 0.0,
   "end": 9.44,
   "text": "так друзья новый зал 250 килограмм новый ягодичный мостик вообще такое не делаю я не очень любитель"
  },
  {
   "start": 9.44,
   "end": 14.44,
   "text": "тренажерных ягодичных мостов не схожи с водным весом верно поэтому у меня здесь такие большие"
  },
  {
   "start": 14.44,
   "end": 19.6,
   "text": "блины 250 килограмм посмотрим и мне почему то кажется что это не я столько поднимаю потому"
  },
  {
   "start": 19.6,
   "end": 24.28,
   "text": "что просто невозможно если у вас есть в зале такой же тренажер то вы должны знать что вы"
  },
  {
   "start": 24.28,
   "end": 29.12,
   "text": "можете намного больше чем кажется давайте сделаем 8-10 в зависимости сколько будет"
  },
  {
   "start": 29.12,
   "end": 34.08,
   "text": "тяжело не путем чинить резину тут в зале все еще в шоке на меня смотрят думают что"
  },
  {
   "start": 34.08,
   "end": 78.86,
   "text": "как это горилла пришла сюда слушайте но здесь еще подстава чтоб еще сотворится с этими поставками"
  },
  {
   "start": 78.86,
   "end": 86.96,
   "text": "грех поставишь если бы я щас не справилась то все опасно опасно это был мой шестой подход"
  },
  {
   "start": 86.96,
   "end": 94.62,
   "text": "идем тренироваться дальше тренировочный день на вместе"
  },
  {
   "start": 94.64,
   "end": 95.64,
   "text": "и"
  }
 ]
}