{
 "clip_id": 36,
 "model": "faster-whisper large-v3",
 "language": "ru",
 "duration": 107.02,
 "segments": [
  {
   "start": 0.0,
   "end": 3.86,
   "text": "Пока ты мечтаешь, я решил содействовать и съесть капсулу для стирки."
  },
  {
   "start": 5.18,
   "end": 8.68,
   "text": "Абсолютно съедобную и из ингредиентов, которые есть дома у каждого."
  },
  {
   "start": 8.76,
   "end": 12.34,
   "text": "Начнем с ядра, для которого нам понадобится подготовить альгинатную ванну,"
  },
  {
   "start": 12.42,
   "end": 15.86,
   "text": "эмульсировав альгинат натрия в воде и оставив на ночь до полной гидротации."
  },
  {
   "start": 15.92,
   "end": 20.0,
   "text": "После этого раствор станет прозрачным и однородным, но тут появляется одна проблема."
  },
  {
   "start": 20.14,
   "end": 24.24,
   "text": "Альгинат активируется только при контакте с хальцодержащим продуктом, например сметаной,"
  },
  {
   "start": 24.3,
   "end": 28.3,
   "text": "на которой при погружении в раствор образуется нужная нам тонкая гелевая оболочка."
  },
  {
   "start": 28.3,
   "end": 33.26,
   "text": "А так как в Тархуне, этом странном голубом лимонаде, и справиться с диоксидом титана его на удивление нету,"
  },
  {
   "start": 33.38,
   "end": 38.76,
   "text": "нам необходимо в них самим добавить вактат кальция в чистом виде и залить в полусферу, поставив в морозильник."
  },
  {
   "start": 38.84,
   "end": 42.04,
   "text": "И только потом замороженные заготовки погружаем в альгинатную ванну,"
  },
  {
   "start": 42.3,
   "end": 45.28,
   "text": "а спустя короткое время перекладываем в холодную воду для промывки."
  },
  {
   "start": 45.34,
   "end": 49.6,
   "text": "И получаем такие прикольные сферы, прочные, внутри жидкие, а еще и очень вкусные."
  },
  {
   "start": 49.72,
   "end": 54.66,
   "text": "А сейчас переходим к съедобному биоразлагаемому пластику, для которого ставим набухиваться желатин,"
  },
  {
   "start": 54.66,
   "end": 58.64,
   "text": "параллельно нагреваем сотейник с водой, глицерином и глюкозой до 40 градусов,"
  },
  {
   "start": 58.74,
   "end": 61.3,
   "text": "после чего добавляем каррагинан капу с агар-агаром."
  },
  {
   "start": 61.44,
   "end": 65.94,
   "text": "А затем, доведя до 60 градусов, растворяем в ней набухший желатин и снимаем с плитки."
  },
  {
   "start": 66.04,
   "end": 69.12,
   "text": "По желанию можете нейтрализовать красителем желтизну от загустителей,"
  },
  {
   "start": 69.44,
   "end": 71.78,
   "text": "главное не переборщить, а то мне пришлось его заново варить."
  },
  {
   "start": 71.88,
   "end": 75.44,
   "text": "Ну а затем выливаем смесь на противень, оставляя дегидрироваться на 2 суток,"
  },
  {
   "start": 75.54,
   "end": 78.76,
   "text": "получая прозрачный и очень прочный материал для покрытия капсул."
  },
  {
   "start": 78.76,
   "end": 81.08,
   "text": "А если сварить его на рыбном бульоне за место воды,"
  },
  {
   "start": 81.08,
   "end": 85.58,
   "text": "то у вас получится блюдо пластик фантастик из двухзвездочного мишленовского ресторана Алхимист."
  },
  {
   "start": 85.7,
   "end": 89.66,
   "text": "И финальной заготовкой для боковых отсеков в виде лепестков приготовил нежный мармелад."
  },
  {
   "start": 89.78,
   "end": 92.72,
   "text": "Повторяться не буду, здесь почти те же самые действия, что с пластиком,"
  },
  {
   "start": 92.8,
   "end": 96.54,
   "text": "но в других пропорциях, расписанных в моем телеграм-канале по ссылке в шапке профиля."
  },
  {
   "start": 96.66,
   "end": 99.92,
   "text": "И теперь, когда все готово, собираем десерт, как показано в видео,"
  },
  {
   "start": 100.0,
   "end": 101.28,
   "text": "я не знаю, как его классифицировать,"
  },
  {
   "start": 101.44,
   "end": 105.3,
   "text": "и фиксируем на пищевой клей карбоксиметилцелилозу, а после наслаждаемся."
  }
 ]
}