{
 "clip_id": 90,
 "model": "faster-whisper large-v3",
 "language": "ru",
 "duration": 43.65,
 "segments": [
  {
   "start": 0.0,
   "end": 3.08,
   "text": "Моя девушка изменила мне и сказала, что я никогда ничего не добьюсь."
  },
  {
   "start": 3.5,
   "end": 6.32,
   "text": "Она ушла к будущему хирургу, он обещал ей богатую свадьбу."
  },
  {
   "start": 6.64,
   "end": 8.62,
   "text": "Но только я знал, что ему все проплатят родители."
  },
  {
   "start": 8.96,
   "end": 10.16,
   "text": "А учиться тот и не собирался."
  },
  {
   "start": 10.4,
   "end": 13.8,
   "text": "Я плакал в падушку, но в тот момент я понял, больше никаких слез."
  },
  {
   "start": 14.12,
   "end": 15.18,
   "text": "Только биология я днями."
  },
  {
   "start": 15.54,
   "end": 18.12,
   "text": "Сидел за тетрадями, даже отказывался от любимой еды своей тетушки."
  },
  {
   "start": 18.48,
   "end": 19.6,
   "text": "Жажда мести была сильнее."
  },
  {
   "start": 20.04,
   "end": 23.36,
   "text": "Я не планировал идти на хирургический, это слишком долго и денег не на скребеш."
  },
  {
   "start": 23.66,
   "end": 24.74,
   "text": "Решил идти на биоинженера."
  },
  {
   "start": 25.02,
   "end": 27.1,
   "text": "Там и зарплата около 95 тысяч на старте."
  },
  {
   "start": 27.1,
   "end": 31.0,
   "text": "Буду конструировать и улучшать живые системы или создавать для них технические устройства."
  },
  {
   "start": 31.32,
   "end": 33.58,
   "text": "Когда я учился на направлении биоинженерия уже два года,"
  },
  {
   "start": 33.92,
   "end": 35.56,
   "text": "на улице я встретил Вушань с ее парнем."
  },
  {
   "start": 35.66,
   "end": 36.76,
   "text": "Ты посмотри на этого бедняка."
  },
  {
   "start": 37.12,
   "end": 38.62,
   "text": "Вот я скоро буду богаче, ха-ха-ха-ха."
  },
  {
   "start": 38.92,
   "end": 40.2,
   "text": "Но они не знали мой план мести."
  }
 ]
}