{
 "clip_id": 12,
 "model": "faster-whisper large-v3",
 "language": "ru",
 "duration": 15.7,
 "segments": [
  {
   "start": 0.0,
   "end": 3.62,
   "text": "Проснулся в темноте, это всего лишь сон"
  },
  {
   "start": 3.62,
   "end": 7.58,
   "text": "Мгновение назад я был уверен, что влюблён"
  },
  {
   "start": 7.58,
   "end": 11.58,
   "text": "Детка, растопи мой лёд, и пусть всё горит огнём"
  },
  {
   "start": 11.58,
   "end": 15.5,
   "text": "Ночью я живу, ну как же я несчастен днём"
  }
 ]
}