{
 "clip_id": 83,
 "model": "faster-whisper large-v3",
 "language": "ru",
 "duration": 111.06,
 "segments": [
  {
   "start": 0.0,
   "end": 2.88,
   "text": "По моему виду видно, что я только что из бассейна, мы с ребенком занимались"
  },
  {
   "start": 2.88,
   "end": 6.08,
   "text": "И вот произошла ситуация, после которой прям выговориться надо"
  },
  {
   "start": 6.08,
   "end": 8.1,
   "text": "Кажется, это систематично, надо вводить сюда рубрику"
  },
  {
   "start": 8.1,
   "end": 10.0,
   "text": "Дайте мне выговориться"
  },
  {
   "start": 10.0,
   "end": 12.18,
   "text": "Девочка, 9, примерно 10 лет"
  },
  {
   "start": 12.18,
   "end": 13.66,
   "text": "Стоит рядом с ней мама"
  },
  {
   "start": 13.66,
   "end": 14.9,
   "text": "В душе"
  },
  {
   "start": 14.9,
   "end": 16.16,
   "text": "Одетая"
  },
  {
   "start": 16.16,
   "end": 18.46,
   "text": "И моет ей голову"
  },
  {
   "start": 18.46,
   "end": 19.82,
   "text": "И моет ее"
  },
  {
   "start": 19.82,
   "end": 24.12,
   "text": "Почти 10, я не знаю, не меньше 9 лет ребенку"
  },
  {
   "start": 24.12,
   "end": 28.18,
   "text": "Нужно научить ребенка уже к 7 годам точно"
  },
  {
   "start": 28.18,
   "end": 31.46,
   "text": "Хорошо, качественно помыть свое тело и свои волосы"
  },
  {
   "start": 31.46,
   "end": 33.98,
   "text": "Я знаю, что у многих есть железобетонный аргумент"
  },
  {
   "start": 33.98,
   "end": 34.96,
   "text": "Очень густых волос"
  },
  {
   "start": 34.96,
   "end": 37.92,
   "text": "И без родительского надзора их невозможно вымыть"
  },
  {
   "start": 37.92,
   "end": 38.98,
   "text": "Сильное заявление"
  },
  {
   "start": 38.98,
   "end": 41.36,
   "text": "Проверять я его, конечно, не буду"
  },
  {
   "start": 41.36,
   "end": 43.8,
   "text": "На Эверест забраться действительно тяжело"
  },
  {
   "start": 43.8,
   "end": 46.16,
   "text": "Научить ребенка мыть тщательно голову"
  },
  {
   "start": 46.16,
   "end": 47.54,
   "text": "Объяснить технику"
  },
  {
   "start": 47.54,
   "end": 48.4,
   "text": "Возможно"
  },
  {
   "start": 48.4,
   "end": 50.36,
   "text": "Может быть не с первого и не с 20 раза"
  },
  {
   "start": 50.36,
   "end": 51.86,
   "text": "Но со 105 точно можно"
  },
  {
   "start": 51.86,
   "end": 54.94,
   "text": "И когда почти 10-летнюю девочку мама намывает в душе"
  },
  {
   "start": 54.94,
   "end": 56.48,
   "text": "Потом она просто стоит"
  },
  {
   "start": 56.48,
   "end": 57.5,
   "text": "Потом ее выводит"
  },
  {
   "start": 57.5,
   "end": 58.16,
   "text": "Потом сушит ей голову"
  },
  {
   "start": 58.18,
   "end": 59.26,
   "text": "Потом ее одевает"
  },
  {
   "start": 59.26,
   "end": 60.16,
   "text": "Потом ее вытирает"
  },
  {
   "start": 60.16,
   "end": 63.0,
   "text": "А потом вопрос"
  },
  {
   "start": 63.0,
   "end": 66.64,
   "text": "Почему у наших детей мало ответственности, самостоятельности и внутренней мотивации"
  },
  {
   "start": 66.64,
   "end": 67.9,
   "text": "Так зачем она нужна"
  },
  {
   "start": 67.9,
   "end": 69.72,
   "text": "Если можно просто стоять столбиком"
  },
  {
   "start": 69.72,
   "end": 72.18,
   "text": "А за тебя, взрослую уже девочку"
  },
  {
   "start": 72.18,
   "end": 73.58,
   "text": "В пубертат заходящую"
  },
  {
   "start": 73.58,
   "end": 74.78,
   "text": "Все сделает мама"
  },
  {
   "start": 74.78,
   "end": 77.68,
   "text": "Из-за большой любви"
  },
  {
   "start": 77.68,
   "end": 78.7,
   "text": "Из-за огромной заботы"
  },
  {
   "start": 78.7,
   "end": 79.58,
   "text": "Здесь спора нет"
  },
  {
   "start": 79.58,
   "end": 81.1,
   "text": "Но есть одна прекрасная фраза"
  },
  {
   "start": 81.1,
   "end": 84.54,
   "text": "Мы обкрадываем детей в тех навыках, которые помогают им"
  },
  {
   "start": 84.54,
   "end": 86.3,
   "text": "Верить в себя, проявлять ответственность"
  },
  {
   "start": 86.3,
   "end": 87.4,
   "text": "Быть замотивированными"
  },
  {
   "start": 87.4,
   "end": 87.9,
   "text": "Быть дисциплинированными"
  },
  {
   "start": 88.18,
   "end": 89.6,
   "text": "Быть целеустремленными"
  },
  {
   "start": 89.6,
   "end": 91.64,
   "text": "Вот с таких мелочей и начинается"
  },
  {
   "start": 91.64,
   "end": 93.84,
   "text": "А когда за тебя все сделают"
  },
  {
   "start": 93.84,
   "end": 95.9,
   "text": "По жизни вообще можно не напрягаться"
  },
  {
   "start": 95.9,
   "end": 99.34,
   "text": "Потому что все всегда кто-то тревожный, переживающий, любящий"
  },
  {
   "start": 99.34,
   "end": 100.84,
   "text": "Все сделает так, как тебе нужно"
  },
  {
   "start": 100.84,
   "end": 103.98,
   "text": "Все за меня делать будете"
  },
  {
   "start": 103.98,
   "end": 107.78,
   "text": "С одной стороны это может быть хорошо"
  },
  {
   "start": 107.78,
   "end": 110.12,
   "text": "Но как бы недолго можно двигаться на таком топливе"
  }
 ]
}