{
 "clip_id": 78,
 "model": "faster-whisper large-v3",
 "language": "ru",
 "duration": 85.12,
 "segments": [
  {
   "start": 0.0,
   "end": 2.84,
   "text": "Как вообще Honda S2000 попала в первый форсаж?"
  },
  {
   "start": 2.92,
   "end": 8.0,
   "text": "И выбор этой машины изначально отличался от выбора всех остальных автомобилей главных героев для этого фильма."
  },
  {
   "start": 8.12,
   "end": 10.58,
   "text": "Так как бюджет на автомобили у первого форсажа был ограничен,"
  },
  {
   "start": 10.7,
   "end": 14.56,
   "text": "то изначально решили арендовать автомобили у обычных уличных гонщиков."
  },
  {
   "start": 14.68,
   "end": 19.2,
   "text": "Изначально Джонни Трана вообще должны были звать Пит Тран, и он должен был ездить на Мустанге."
  },
  {
   "start": 19.38,
   "end": 23.9,
   "text": "И Крейг Либерман, это автоконсультант первых двух форсажей, который отвечал за автомобили в фильме,"
  },
  {
   "start": 24.08,
   "end": 25.74,
   "text": "был совершенно не против этой идеи."
  },
  {
   "start": 25.9,
   "end": 29.56,
   "text": "Ну, по сути, типичный американец ездит на типичной американской машине."
  },
  {
   "start": 29.56,
   "end": 35.02,
   "text": "Но потом он обсудил эту идею с техническим автомобильным консультантом, а именно с Арджидой Верой."
  },
  {
   "start": 35.06,
   "end": 38.74,
   "text": "Это тот самый парень, который сыграл гонщика в первой гонке на белом Сивике."
  },
  {
   "start": 38.98,
   "end": 40.88,
   "text": "И по сюжету его, кстати, звали Дэнни Ямато."
  },
  {
   "start": 41.06,
   "end": 45.08,
   "text": "И после того, как в сценарии Пита Трана переименовали в Джонни Трана, и он стал азиатом,"
  },
  {
   "start": 45.16,
   "end": 49.76,
   "text": "вот тогда Либерман и Арджидой Вера решили, что он все-таки должен ездить на японской машине."
  },
  {
   "start": 49.9,
   "end": 52.34,
   "text": "Тогда с этой идеей они пошли к Дэвиду Мартеру."
  },
  {
   "start": 52.4,
   "end": 55.98,
   "text": "Это человек от студии, который курировал работу Либермана и Арджиды Веры."
  },
  {
   "start": 55.98,
   "end": 59.46,
   "text": "Потому что Мустанг как бы был утвержден, но ему идея очень понравилась."
  },
  {
   "start": 59.56,
   "end": 61.36,
   "text": "Хонда из 2000, и он дал добро."
  },
  {
   "start": 61.5,
   "end": 63.38,
   "text": "И сразу после этого спросил у Арджиды Веры,"
  },
  {
   "start": 63.48,
   "end": 65.52,
   "text": "слушай, а можно арендовать твою машину?"
  },
  {
   "start": 65.62,
   "end": 69.62,
   "text": "Потому что Арджиды Вера как раз-таки тогда гонял на черной Хонде из 2000."
  },
  {
   "start": 69.98,
   "end": 71.44,
   "text": "И Арджиды Вера согласился."
  },
  {
   "start": 71.64,
   "end": 75.4,
   "text": "У Либермана из студии отпала нужда устраивать автомобильные кастинги снова,"
  },
  {
   "start": 75.48,
   "end": 77.58,
   "text": "на которые опять перевезут гонщики свои машины,"
  },
  {
   "start": 77.66,
   "end": 80.68,
   "text": "на которых опять нужно будет ходить, выбирать, упрашивать отдать эту машину."
  },
  {
   "start": 80.94,
   "end": 84.88,
   "text": "А здесь Арджиды Вера согласился, и ему за это заплатили 6400 долларов."
  }
 ]
}