{
 "clip_id": 89,
 "model": "faster-whisper large-v3",
 "language": "ru",
 "duration": 114.45,
 "segments": [
  {
   "start": 0.0,
   "end": 8.76,
   "text": "Многие из вас присылали мне историю Анны Ковалкиной, которая записала видео о том, что ей предложили работать на новых условиях в её больнице."
  },
  {
   "start": 8.96,
   "end": 15.44,
   "text": "Впрочем, уведомление. Больница в одностороннем порядке решила изменить нам условия работы с сохранением заработной платы, прежней."
  },
  {
   "start": 15.96,
   "end": 19.66,
   "text": "Теперь мы должны будем работать, вести приём амбулаторный не 33 часа, а 39 часов."
  },
  {
   "start": 20.42,
   "end": 22.32,
   "text": "Причём этот приём осуществляется по 11 минут на человека."
  },
  {
   "start": 22.68,
   "end": 26.84,
   "text": "То есть вместо того, чтобы принимать порядка 35 человек в день, теперь мы будем принимать 50 человек в день."
  },
  {
   "start": 26.84,
   "end": 31.86,
   "text": "Доктор не согласилась с новыми условиями, обратился в суд, в трудовую инспекцию."
  },
  {
   "start": 32.16,
   "end": 38.58,
   "text": "29 сентября суд первой инстанции отклонил иск, но Анна была намерена обжаловать это решение."
  },
  {
   "start": 38.68,
   "end": 40.78,
   "text": "Пришли мы к вам с несколькими вопросами."
  },
  {
   "start": 41.1,
   "end": 49.48,
   "text": "Вопрос номер один. Согласно уведомлению номер 1841, до первого числа включительно мы вам предоставили время дать нам ответ на текст уведомления."
  },
  {
   "start": 49.94,
   "end": 53.5,
   "text": "Вчера от вас ответа не поступило, но, соответственно, включительное число прошло, мы пришли сегодня."
  },
  {
   "start": 53.5,
   "end": 56.0,
   "text": "И ещё раз вас спрашиваю, ваше решение."
  },
  {
   "start": 56.84,
   "end": 58.72,
   "text": "Сохранение отлежных условий трудового договора."
  },
  {
   "start": 58.9,
   "end": 65.94,
   "text": "Уже 2 октября на следующий день к ней пришли и попросили дать окончательный ответ, согласна ли она на новые условия труда."
  },
  {
   "start": 66.06,
   "end": 74.9,
   "text": "По словам доктора, кстати, немаловажно, там были такие должности по совместительству, как офтальмолог в детской поликлинике, оператор и уборщик в помещении."
  },
  {
   "start": 75.38,
   "end": 77.84,
   "text": "Доктор отказалась, трудовой договор с ней расторгли."
  },
  {
   "start": 77.84,
   "end": 84.84,
   "text": "Причём ранее Минздрав говорил, что заявление публичное доктора не имеет никакого отношения к действительности."
  },
  {
   "start": 84.84,
   "end": 96.84,
   "text": "И знаете, эта ситуация заставляет задуматься, а где же всё-таки баланс, вот знаете, вот этот баланс человеческий между временем приёма на каждого пациента, между договором трудовым, между условиями."
  },
  {
   "start": 96.84,
   "end": 100.84,
   "text": "Я всё понимаю, но увольнять, мне кажется, это контрмера."
  },
  {
   "start": 100.84,
   "end": 108.84,
   "text": "Доктору я желаю от всей души на новом месте работы чувствовать себя комфортно, чтобы условия были адекватные и приемлемые."
  },
  {
   "start": 108.84,
   "end": 113.84,
   "text": "А вы, друзья, в комментариях пишите, что думаете об этой ситуации. Давайте обсуждать."
  }
 ]
}