{
 "clip_id": 6,
 "model": "faster-whisper large-v3",
 "language": "ru",
 "duration": 254.69,
 "segments": [
  {
   "start": 0.0,
   "end": 3.32,
   "text": "Кто вам сказал, что а, у HR должна присутствовать хоть какая-то логика,"
  },
  {
   "start": 3.46,
   "end": 7.16,
   "text": "и б, что если эта логика есть, то она должна быть в вашу пользу?"
  },
  {
   "start": 7.22,
   "end": 9.52,
   "text": "Вот меня не берут на работу, потому что я прошла курс."
  },
  {
   "start": 9.56,
   "end": 11.72,
   "text": "А для большинства HR курсы это red flag."
  },
  {
   "start": 11.8,
   "end": 15.2,
   "text": "А как тогда людям переобучаться, если не на курсах, чё и уйти на вышку?"
  },
  {
   "start": 15.64,
   "end": 18.26,
   "text": "Рассказываю, что об этом думают HR и большинство темледов,"
  },
  {
   "start": 18.32,
   "end": 21.62,
   "text": "то есть руководители отдела, от кого я это слышал прямым текстом."
  },
  {
   "start": 21.7,
   "end": 22.68,
   "text": "От большинства!"
  },
  {
   "start": 22.92,
   "end": 23.92,
   "text": "В чём же их логика?"
  },
  {
   "start": 24.04,
   "end": 26.38,
   "text": "Какой идеальный портрет кандидата для них?"
  },
  {
   "start": 26.38,
   "end": 29.38,
   "text": "В седьмом классе ты уже твёрдо должен решить, что ты хочешь быть программистом."
  },
  {
   "start": 30.06,
   "end": 34.54,
   "text": "В девятом классе ты уже должен выиграть областную олимпиаду по программированию"
  },
  {
   "start": 34.54,
   "end": 37.34,
   "text": "и сдать обязательно ОГЭ по физике."
  },
  {
   "start": 37.5,
   "end": 41.38,
   "text": "В одиннадцатом классе ты уже должен был свободно писать на Python и знать MySQL"
  },
  {
   "start": 41.38,
   "end": 46.02,
   "text": "и даже делать коммерческие заказы на kwork и freelance.com."
  },
  {
   "start": 46.26,
   "end": 49.0,
   "text": "Очевидно, ИГЭ ты должен был сдать по информатике и физике"
  },
  {
   "start": 49.0,
   "end": 53.1,
   "text": "и поступить на бюджет в московский физтех на разработку программного обеспечения."
  },
  {
   "start": 53.1,
   "end": 56.34,
   "text": "На втором курсе физтеха ты уже должен был писать на C микроконтроллеры"
  },
  {
   "start": 56.34,
   "end": 59.16,
   "text": "для большого андронного коллайдера в Церни в Швейцарии."
  },
  {
   "start": 59.16,
   "end": 64.48,
   "text": "На четвёртом курсе, прямо перед поступлением в магистратуру на ту же самую разработку программного обеспечения,"
  },
  {
   "start": 64.58,
   "end": 69.72,
   "text": "ты уже должен был выиграть региональную олимпиаду по программированию и разработку по округу Нью-Йорк."
  },
  {
   "start": 69.8,
   "end": 74.98,
   "text": "И вот по окончанию магистратуры, когда у тебя уже 10 лет опыта разработки"
  },
  {
   "start": 74.98,
   "end": 77.8,
   "text": "с выигранной олимпиадой в Нью-Йорке на английском языке,"
  },
  {
   "start": 77.94,
   "end": 81.44,
   "text": "ты должен был очень сильно удариться головой об стену"
  },
  {
   "start": 81.44,
   "end": 87.54,
   "text": "и захотеть работать разработчиком в челяб с антихпроме на их отделение интернет вещей"
  },
  {
   "start": 87.54,
   "end": 89.14,
   "text": "и разрабатывать микрокурс."
  },
  {
   "start": 89.16,
   "end": 96.7,
   "text": "Микроконтроллеры для пенистых рукомойников, чтобы эти пенистые рукомойники генерировали пену по кнопке в приложении."
  },
  {
   "start": 96.78,
   "end": 102.0,
   "text": "Wi-Fi ты должен разрабатывать это приложение, конечно же, как джуниор-стажер-разработчик"
  },
  {
   "start": 102.0,
   "end": 105.1,
   "text": "на бесплатной сажировке в течение двух месяцев."
  },
  {
   "start": 105.22,
   "end": 110.42,
   "text": "При этом фишка по удалённой генерации пены из пенистого рукомойника челяб с антихпрома по клику"
  },
  {
   "start": 110.42,
   "end": 115.6,
   "text": "из приложения, которое ты разрабатываешь, конечно же, для пользователя пенистого рукомойника"
  },
  {
   "start": 115.6,
   "end": 117.5,
   "text": "будет платной функцией по подписке."
  },
  {
   "start": 117.5,
   "end": 118.92,
   "text": "Вот это и есть для."
  },
  {
   "start": 119.16,
   "end": 125.7,
   "text": "Российского HR-а идеальный работник, который выбрал свою стезю один раз в 16 лет"
  },
  {
   "start": 125.7,
   "end": 128.14,
   "text": "и всю жизнь бьёт в эту одну точку."
  },
  {
   "start": 128.22,
   "end": 132.12,
   "text": "Почему такой высококлассный специалист вообще должен работать в челяб с антихпроме,"
  },
  {
   "start": 132.16,
   "end": 133.56,
   "text": "они, конечно же, не объясняют."
  },
  {
   "start": 133.62,
   "end": 139.16,
   "text": "То бишь, не в курсах проблема, а в том, что институционально вот это вот твоё право"
  },
  {
   "start": 139.16,
   "end": 145.44,
   "text": "на переподготовку, на смену профессии, оно в обществе у HR-ов и у тимлидов,"
  },
  {
   "start": 145.44,
   "end": 148.94,
   "text": "у руководителя отдела, оно вообще в условиях российского общества,"
  },
  {
   "start": 149.16,
   "end": 150.16,
   "text": "не закреплено."
  },
  {
   "start": 150.16,
   "end": 153.52,
   "text": "Вопросы о том, что очень много людей за 10 лет работы"
  },
  {
   "start": 153.52,
   "end": 157.54,
   "text": "в какой-то сфере, они могут выгореть, это вообще не обсуждается."
  },
  {
   "start": 157.54,
   "end": 160.0,
   "text": "То, что твоя профессия может стать не нужна, но ты подковывал"
  },
  {
   "start": 160.0,
   "end": 163.22,
   "text": "лошадей, а теперь везде машины, ты хочешь стать"
  },
  {
   "start": 163.22,
   "end": 166.9,
   "text": "автомобильным слесарем, нет, не можешь, ты как подкователь"
  },
  {
   "start": 166.9,
   "end": 169.04,
   "text": "лошадей просто должен сдохнуть от голода."
  },
  {
   "start": 169.04,
   "end": 172.14,
   "text": "Вот на это, по мнению HR-ов, ты право имеешь, а сменить"
  },
  {
   "start": 172.14,
   "end": 174.54,
   "text": "профессию в 30-40 лет – нет."
  },
  {
   "start": 174.54,
   "end": 178.44,
   "text": "За тобой институционально закреплено право страдать."
  },
  {
   "start": 178.44,
   "end": 179.16,
   "text": "Нет?"
  },
  {
   "start": 179.16,
   "end": 180.4,
   "text": "Это ты право имеешь."
  },
  {
   "start": 180.4,
   "end": 183.28,
   "text": "А вот то, что у тебя есть право быть счастливым,"
  },
  {
   "start": 183.28,
   "end": 185.94,
   "text": "менять профессию, проходить курсы – такого права за"
  },
  {
   "start": 185.94,
   "end": 187.3,
   "text": "тобой не закреплено."
  },
  {
   "start": 187.3,
   "end": 191.28,
   "text": "Посмотрите, что HR-ы-консультанты говорят в соцсетях."
  },
  {
   "start": 191.28,
   "end": 193.72,
   "text": "Они говорят, что счастливый человек, который не имеет"
  },
  {
   "start": 193.72,
   "end": 197.04,
   "text": "ипотек, социальных якорей, каких-то обязанностей их"
  },
  {
   "start": 197.04,
   "end": 200.96,
   "text": "брать не нужно, потому что ты у них долго не проработаешь."
  },
  {
   "start": 200.96,
   "end": 203.88,
   "text": "А что же говорить про человека, который пошел на курсы,"
  },
  {
   "start": 203.88,
   "end": 206.68,
   "text": "учиться, он хочет стать счастливым, делать то,"
  },
  {
   "start": 206.68,
   "end": 209.16,
   "text": "что ему нравится, зарабатывать больше денег, чем с чем-то"
  },
  {
   "start": 209.16,
   "end": 210.98,
   "text": "другое, чем те деньги, которые есть в его профессии"
  },
  {
   "start": 210.98,
   "end": 211.98,
   "text": "сегодня?"
  },
  {
   "start": 211.98,
   "end": 215.2,
   "text": "Ну это вообще какой-то вот этот западный нонсенс."
  },
  {
   "start": 215.2,
   "end": 217.66,
   "text": "Поэтому я считаю, что если вы прошли какие-то курсы"
  },
  {
   "start": 217.66,
   "end": 220.94,
   "text": "переподготовки, то найм в России – это вообще худший"
  },
  {
   "start": 220.94,
   "end": 221.94,
   "text": "вариант."
  },
  {
   "start": 221.94,
   "end": 225.22,
   "text": "Найм в Европе, в Америке – да, потому что ваше институциональное"
  },
  {
   "start": 225.22,
   "end": 228.16,
   "text": "право на переподготовку, смену профессии во взрослом"
  },
  {
   "start": 228.16,
   "end": 232.16,
   "text": "возрасте там будет оспариваться гораздо реже."
  },
  {
   "start": 232.16,
   "end": 234.88,
   "text": "И в целом, если вы там в 35-40 лет обучились ремонту"
  },
  {
   "start": 234.88,
   "end": 238.28,
   "text": "электросамокатов, ремонту обслуживания холодильников,"
  },
  {
   "start": 238.28,
   "end": 239.04,
   "text": "то вам гораздо проще."
  },
  {
   "start": 239.04,
   "end": 243.28,
   "text": "Быть фрилансером, искать себе заказы самостоятельно,"
  },
  {
   "start": 243.28,
   "end": 245.18,
   "text": "нежели пытаться пробиться в найм."
  },
  {
   "start": 245.18,
   "end": 248.04,
   "text": "Потому что ну вот такое вот мнение среди эйчаров"
  },
  {
   "start": 248.04,
   "end": 250.8,
   "text": "и тимлидов, оно присутствует."
  },
  {
   "start": 250.8,
   "end": 253.66,
   "text": "Короче, проблема не в курсах, а проблема гораздо глубже."
  },
  {
   "start": 253.66,
   "end": 254.66,
   "text": "Что стоит за этими курсами?"
  }
 ]
}