{
 "clip_id": 82,
 "model": "faster-whisper large-v3",
 "language": "ru",
 "duration": 34.95,
 "segments": [
  {
   "start": 0.85,
   "end": 4.31,
   "text": "На осетровом донском заводе используют метод дойки."
  },
  {
   "start": 4.63,
   "end": 8.51,
   "text": "На брюшки делают надрез, и чёрные шарики льются в ведро подставляй."
  },
  {
   "start": 8.77,
   "end": 10.65,
   "text": "Так и крацело, и рыба невредима."
  },
  {
   "start": 10.85,
   "end": 13.77,
   "text": "От массы тела получаем 10-15% сырья."
  },
  {
   "start": 14.05,
   "end": 15.83,
   "text": "Процедура длится до трёх минут."
  },
  {
   "start": 16.13,
   "end": 17.55,
   "text": "За раз рыба отдаёт не всё."
  },
  {
   "start": 17.81,
   "end": 19.43,
   "text": "Между подходами нужен перерыв."
  },
  {
   "start": 19.89,
   "end": 23.31,
   "text": "Отстрелявшись, роженица отдыхает в палате интенсивной терапии."
  },
  {
   "start": 23.67,
   "end": 26.23,
   "text": "За ней понаблюдали, с ней всё хорошо."
  },
  {
   "start": 26.55,
   "end": 30.07,
   "text": "Она пришла в себя, то есть травмировали, проверяем, чтобы не кровило, ничего."
  },
  {
   "start": 30.07,
   "end": 31.87,
   "text": "Если нужно, мы прокалываем вторично."
  },
  {
   "start": 32.41,
   "end": 34.79,
   "text": "Если не нужно, мы отправляем всё к рыбе."
  }
 ]
}