{
 "clip_id": 1,
 "model": "faster-whisper large-v3",
 "language": "ru",
 "duration": 279.17,
 "segments": [
  {
   "start": 0.14,
   "end": 4.14,
   "text": "Доставай дозиметр, потому что твой код может забанить человека прямо в жизни."
  },
  {
   "start": 5.14,
   "end": 11.2,
   "text": "Думаешь, твой говнокод максимум уронит прод, сломает корзину в интернет-магазине или потеряет пару тысяч баксов?"
  },
  {
   "start": 11.62,
   "end": 12.26,
   "text": "Хуй там!"
  },
  {
   "start": 12.96,
   "end": 15.96,
   "text": "Твой говнокод может буквально забанить человека в реальной жизни."
  },
  {
   "start": 16.96,
   "end": 18.64,
   "text": "Садитесь поближе, малолетние хакеры."
  },
  {
   "start": 19.24,
   "end": 21.38,
   "text": "Сегодня дед расскажет вам про теракт 25."
  },
  {
   "start": 22.06,
   "end": 26.22,
   "text": "Историю, от которой у любого нормального инженера очко сжимается в сингулярность."
  },
  {
   "start": 26.22,
   "end": 34.56,
   "text": "Историю о том, как ебаные многопоточности и самоуверенность разработчиков натурально начали выдавать людям пермачи на физическом сервере."
  },
  {
   "start": 34.58,
   "end": 38.26,
   "text": "В 80-е годы канадцы строят чудо-аппарат для лучевой терапии."
  },
  {
   "start": 39.2,
   "end": 41.12,
   "text": "Объясняю на пальцы, как эта ебанина работала."
  },
  {
   "start": 41.86,
   "end": 43.06,
   "text": "У нее было два режима."
  },
  {
   "start": 43.6,
   "end": 48.6,
   "text": "Лайтовый на электронах, слабенький пучок, чисто пощекотать опухоль, пациент живет дальше."
  },
  {
   "start": 49.34,
   "end": 50.16,
   "text": "И второй режим."
  },
  {
   "start": 50.44,
   "end": 51.9,
   "text": "Ядерного аннигилятора!"
  },
  {
   "start": 52.48,
   "end": 55.52,
   "text": "Включается адская пушка на 25 миллионов электрон-вольт."
  },
  {
   "start": 55.52,
   "end": 59.62,
   "text": "Чтоб от такого прикола человек не выкинул исключения из жизненного цикла,"
  },
  {
   "start": 59.98,
   "end": 64.56,
   "text": "между пушкой и телом обязательно должна была встать тяжеленная вольфрамовая пластина."
  },
  {
   "start": 65.06,
   "end": 67.94,
   "text": "Она рассеивает луч в безопасный рентгеновский спектр."
  },
  {
   "start": 68.92,
   "end": 71.42,
   "text": "В старых моделях стояли железные тумблеры и концовики."
  },
  {
   "start": 71.84,
   "end": 72.88,
   "text": "Механические реле."
  },
  {
   "start": 73.5,
   "end": 79.62,
   "text": "Если пластина физически не встала на место, цепь размыкалась, и пушка физически не могла выстрелить, хоть обосрись."
  },
  {
   "start": 80.52,
   "end": 84.14,
   "text": "И тут приходят канадские программисты, предки нынешних вайп-кодеров."
  },
  {
   "start": 84.14,
   "end": 84.96,
   "text": "И такие."
  },
  {
   "start": 84.96,
   "end": 88.84,
   "text": "Слышите, а нахуя нам эти тяжеленные железные предохранители?"
  },
  {
   "start": 88.84,
   "end": 92.48,
   "text": "Давайте выкинем железо на помойку и закодим всё на софте."
  },
  {
   "start": 92.48,
   "end": 96.84,
   "text": "Напишем код на ассембере, у нас в коде багов не бывает, мы ж гении, сука!"
  },
  {
   "start": 96.84,
   "end": 100.72,
   "text": "Они выкинули аппаратную, блять, защиту."
  },
  {
   "start": 100.72,
   "end": 104.4,
   "text": "Оставили проверку чисто на сраных байтиках в оперативной памяти."
  },
  {
   "start": 104.4,
   "end": 108.2,
   "text": "А теперь смотрите, сука, что такое гонка потоков."
  },
  {
   "start": 108.2,
   "end": 110.52,
   "text": "Race Condition в реальной жизни, сука."
  },
  {
   "start": 110.52,
   "end": 113.0,
   "text": "В клинике сидит тётенька-оператор."
  },
  {
   "start": 113.0,
   "end": 114.8,
   "text": "Пальцы летают по терминалу."
  },
  {
   "start": 114.8,
   "end": 117.24,
   "text": "Как у задрота в доту 2 на инвокере."
  },
  {
   "start": 117.24,
   "end": 121.96,
   "text": "Она случайно нажимает клавишу X, то есть режим ядерной аннигиляции."
  },
  {
   "start": 121.96,
   "end": 127.24,
   "text": "А потом понимает, ой, блять, нужен же режим E, электроны."
  },
  {
   "start": 127.24,
   "end": 131.6,
   "text": "Жмёт стрелочку вверх, исправляет X на E и хуярит Enter."
  },
  {
   "start": 131.6,
   "end": 133.96,
   "text": "На всё ушло полторы секунды."
  },
  {
   "start": 133.96,
   "end": 136.92,
   "text": "А софт писали гении, без синхронизации задач."
  },
  {
   "start": 136.92,
   "end": 141.8,
   "text": "Интерфейс успел обновиться и радостно пишет, режим электроны, всё заебись."
  },
  {
   "start": 141.8,
   "end": 144.8,
   "text": "При этом часть кода, которая поворачивает в альфрамовую пластину,"
  },
  {
   "start": 144.8,
   "end": 147.92,
   "text": "сука, ей надо 8 секунд, чтобы её сдвинуть."
  },
  {
   "start": 147.92,
   "end": 152.08,
   "text": "Из-за того, что данные вбили быстрее, флаги все перетёрлись,"
  },
  {
   "start": 152.08,
   "end": 156.16,
   "text": "и софт подумал, что пластина не нужна, мы ж, сука, в режиме электронов."
  },
  {
   "start": 156.16,
   "end": 160.64,
   "text": "А пушка-то взведена на 25 миллионов электрон-вольт."
  },
  {
   "start": 160.64,
   "end": 165.96,
   "text": "Итог, в альфрамовые пластины нет, а пушка ебашит на полную мощность."
  },
  {
   "start": 165.96,
   "end": 169.52,
   "text": "Прямо в пациента прилетает сырой луч из открытого космоса."
  },
  {
   "start": 169.52,
   "end": 173.48,
   "text": "Доза радиации превышена в 100, сука, в 200 раз."
  },
  {
   "start": 173.48,
   "end": 174.6,
   "text": "Человека буквально."
  },
  {
   "start": 174.6,
   "end": 177.28,
   "text": "Буквально облучает так, что его биологический рантайм"
  },
  {
   "start": 177.28,
   "end": 178.28,
   "text": "крашится."
  },
  {
   "start": 178.28,
   "end": 180.6,
   "text": "Но вы думаете, это всё?"
  },
  {
   "start": 180.6,
   "end": 181.6,
   "text": "Хуй там!"
  },
  {
   "start": 181.6,
   "end": 183.88,
   "text": "Там был ещё один баг."
  },
  {
   "start": 183.88,
   "end": 186.32,
   "text": "Переполнение однобайтового счётчика."
  },
  {
   "start": 186.32,
   "end": 187.32,
   "text": "Шоколада."
  },
  {
   "start": 187.32,
   "end": 188.32,
   "text": "Вопрос."
  },
  {
   "start": 188.32,
   "end": 190.84,
   "text": "Сколько можно уместить в одном байте?"
  },
  {
   "start": 190.84,
   "end": 192.56,
   "text": "Правильно, 255."
  },
  {
   "start": 192.56,
   "end": 194.84,
   "text": "А что, если прибавить единицу?"
  },
  {
   "start": 194.84,
   "end": 195.84,
   "text": "Правильно."
  },
  {
   "start": 195.84,
   "end": 198.0,
   "text": "Счётчик сбрасывается в ноль."
  },
  {
   "start": 198.0,
   "end": 200.94,
   "text": "А в аппарате крутился цикл проверки, и каждый раз,"
  },
  {
   "start": 200.94,
   "end": 203.6,
   "text": "когда мотор двигался, переменное делало плюс один."
  },
  {
   "start": 203.6,
   "end": 204.6,
   "text": "А проверка на выставке?"
  },
  {
   "start": 204.6,
   "end": 206.32,
   "text": "Стрел выглядела так."
  },
  {
   "start": 206.32,
   "end": 210.36,
   "text": "Если счётчик равен нулю, можно стрелять."
  },
  {
   "start": 210.36,
   "end": 212.36,
   "text": "Потому что ноль для этого архитектора означал ошибок"
  },
  {
   "start": 212.36,
   "end": 213.36,
   "text": "нет."
  },
  {
   "start": 213.36,
   "end": 217.06,
   "text": "И если оператор жал кнопку огонь ровно на 256 шаге, когда"
  },
  {
   "start": 217.06,
   "end": 219.68,
   "text": "счётчик на миллисекунду обнулялся, машина вырубала"
  },
  {
   "start": 219.68,
   "end": 222.28,
   "text": "все проверки и отправляла пациента на спаун в другое"
  },
  {
   "start": 222.28,
   "end": 223.28,
   "text": "измерение."
  },
  {
   "start": 223.28,
   "end": 227.6,
   "text": "А на экране терминала загоралась malfunction 54."
  },
  {
   "start": 227.6,
   "end": 231.76,
   "text": "И в методичке даже не было написано, что это."
  },
  {
   "start": 231.76,
   "end": 234.28,
   "text": "Операторы думали, что доза не прошла и жали кнопку"
  },
  {
   "start": 234.28,
   "end": 237.82,
   "text": "P, т.е. продолжить, и оформляли человеку повторный билет"
  },
  {
   "start": 237.82,
   "end": 238.9,
   "text": "в лобби."
  },
  {
   "start": 238.9,
   "end": 241.34,
   "text": "Шесть человек принудительно отключались от серверов"
  },
  {
   "start": 241.34,
   "end": 244.94,
   "text": "планеты Земля, а компания разработчик годами отмазывалась,"
  },
  {
   "start": 244.94,
   "end": 247.7,
   "text": "мол наш код идеален, это ваши медсёстры криво кнопки"
  },
  {
   "start": 247.7,
   "end": 250.07,
   "text": "нажимают."
  },
  {
   "start": 250.07,
   "end": 254.97,
   "text": "Так что если вам говорят учить многопоточность,"
  },
  {
   "start": 254.97,
   "end": 258.31,
   "text": "атомики, не надо закатывать глаза, потому что в вебе"
  },
  {
   "start": 258.31,
   "end": 260.41,
   "text": "ваш кривой код максимум уронит сессию пользователя."
  },
  {
   "start": 260.41,
   "end": 264.11,
   "text": "А в реальном мире один кривой флс и переполненный байт"
  },
  {
   "start": 264.11,
   "end": 265.41,
   "text": "могут раздать перманентные банки."
  },
  {
   "start": 265.41,
   "end": 269.91,
   "text": "Не баны живым людям, учите матчасть, читайте документацию"
  },
  {
   "start": 269.91,
   "end": 273.15,
   "text": "и никогда, слышите, никогда не выкидывайте аппаратные"
  },
  {
   "start": 273.15,
   "end": 274.45,
   "text": "предохранители."
  },
  {
   "start": 274.45,
   "end": 277.61,
   "text": "У меня всё, залетайте в телегу, там дед принимает"
  },
  {
   "start": 277.61,
   "end": 278.69,
   "text": "ваш говнокод на ревью."
  }
 ]
}