{
 "clip_id": 13,
 "model": "faster-whisper large-v3",
 "language": "ru",
 "duration": 227.81,
 "segments": [
  {
   "start": 0.05,
   "end": 2.69,
   "text": "Я перестаю ходить. Время вышло."
  },
  {
   "start": 3.15,
   "end": 7.09,
   "text": "Сначала у меня отказал мочевой пузырь, а теперь у меня отказывают ноги,"
  },
  {
   "start": 7.71,
   "end": 10.75,
   "text": "потому что, по словам врачей, мы потеряли слишком много времени."
  },
  {
   "start": 11.13,
   "end": 14.77,
   "text": "Я не виню сейчас врачей, я виню именно систему."
  },
  {
   "start": 15.45,
   "end": 22.43,
   "text": "Два месяца я ходила по врачам с проблемой отсутствия позыва в туалет и двумя случаями АЗМ."
  },
  {
   "start": 22.43,
   "end": 27.19,
   "text": "Меня посылали все врачи, а сейчас у меня отказала стопа."
  },
  {
   "start": 27.19,
   "end": 33.67,
   "text": "Мне 18 лет, и я хожу с тростью, потому что моя нога, она тупо мне не слушается."
  },
  {
   "start": 34.01,
   "end": 36.35,
   "text": "Я не знаю, когда она откажет до конца."
  },
  {
   "start": 36.75,
   "end": 40.63,
   "text": "Через два месяца, через месяц, через неделю, а может быть и завтра."
  },
  {
   "start": 40.91,
   "end": 43.61,
   "text": "11 сентября меня госпитализировали в коммунарку."
  },
  {
   "start": 44.15,
   "end": 47.81,
   "text": "Тогда у меня только все начиналось, и я говорила об этом каждому врачу,"
  },
  {
   "start": 48.17,
   "end": 56.85,
   "text": "терапевту, хирургу, нейрохирургу, урологу, инфекционистам, нашелся каким-то боком, гинекологу об этом говорила."
  },
  {
   "start": 57.19,
   "end": 65.91,
   "text": "Меня осмотрели все и всю, но никто не посмотрел мою ногу, все забили вообще на мою жалобу по поводу онемения стопы."
  },
  {
   "start": 66.57,
   "end": 70.25,
   "text": "В заключение этого дня мне написали мышечная сила в норме."
  },
  {
   "start": 70.61,
   "end": 72.07,
   "text": "А знаете, почему в норме?"
  },
  {
   "start": 72.61,
   "end": 74.99,
   "text": "Потому что до нее даже никто не дотронулся."
  },
  {
   "start": 75.53,
   "end": 81.63,
   "text": "Меня хотели выписать через 9 часов пребывания в диагностическом палате со словами «катетеризируйся» и все."
  },
  {
   "start": 82.19,
   "end": 85.99,
   "text": "И отпустить домой с онемевшей ногой, без осмотра невролога."
  },
  {
   "start": 85.99,
   "end": 86.99,
   "text": "15 сентября."
  },
  {
   "start": 87.19,
   "end": 91.29,
   "text": "16 сентября мои родители добились того, чтобы меня наконец-то осмотрел невролог."
  },
  {
   "start": 91.77,
   "end": 96.31,
   "text": "Она пришла, посмотрела и поставила мне диагноз «порез стопы» и все. И ушла."
  },
  {
   "start": 96.79,
   "end": 103.63,
   "text": "16 сентября другой врач сказал мне, что если сейчас порез стопы, то через месяц ты вообще ходить не сможешь."
  },
  {
   "start": 103.85,
   "end": 106.99,
   "text": "Оказывается, я не выдумывала, и я наконец-то добилась диагноза."
  },
  {
   "start": 108.11,
   "end": 111.95,
   "text": "Это сирингомелия, а сирингомелия – это поражение спинного мозга."
  },
  {
   "start": 111.95,
   "end": 115.91,
   "text": "Но вот как бывает, я добилась этого диагноза слишком поздно."
  },
  {
   "start": 116.23,
   "end": 116.95,
   "text": "Потому что пока я ходила..."
  },
  {
   "start": 117.19,
   "end": 120.55,
   "text": "Я ходила по кабинетам, мое тело, оно продолжало ломаться."
  },
  {
   "start": 121.01,
   "end": 124.19,
   "text": "Пока они перекладывали бумажки, я переставала чувствовать."
  },
  {
   "start": 125.13,
   "end": 127.51,
   "text": "Потом я перестала нормально ходить в туалет."
  },
  {
   "start": 127.99,
   "end": 129.69,
   "text": "А теперь я перестаю ходить."
  },
  {
   "start": 130.01,
   "end": 131.09,
   "text": "Теперь про систему."
  },
  {
   "start": 131.57,
   "end": 133.47,
   "text": "Потому что дело далеко не в врачах."
  },
  {
   "start": 134.09,
   "end": 136.65,
   "text": "В поликлинике мне не дают направление в больницу."
  },
  {
   "start": 136.93,
   "end": 138.33,
   "text": "Они говорят, иди к урологу."
  },
  {
   "start": 138.59,
   "end": 139.97,
   "text": "Уролог – иди к неврологу."
  },
  {
   "start": 140.31,
   "end": 142.19,
   "text": "Невролог – это не ко мне, иди к нейрохирургу."
  },
  {
   "start": 142.87,
   "end": 145.67,
   "text": "И так по кругу, два месяца, круг ада."
  },
  {
   "start": 145.67,
   "end": 147.17,
   "text": "Я бегала, бегала."
  },
  {
   "start": 147.19,
   "end": 149.59,
   "text": "Только теперь я бегаю с палкой."
  },
  {
   "start": 150.19,
   "end": 155.41,
   "text": "В больнице говорят, операция нужна, потом не нужна, потом нужна, потом не нужна."
  },
  {
   "start": 155.71,
   "end": 159.97,
   "text": "Меня пинают, а я жду, и я надеюсь, и снова жду, и снова надеюсь."
  },
  {
   "start": 160.81,
   "end": 165.03,
   "text": "Когда я лежала в больнице, меня кололи только обезболивающие, и все."
  },
  {
   "start": 165.65,
   "end": 166.83,
   "text": "Мне не смотрели врачи."
  },
  {
   "start": 166.89,
   "end": 169.23,
   "text": "Ну, смотрели, но это было очень поверхностно."
  },
  {
   "start": 169.95,
   "end": 171.31,
   "text": "А потом отправили домой."
  },
  {
   "start": 171.89,
   "end": 174.19,
   "text": "На самотек со словами «катетеризируйся» и все."
  },
  {
   "start": 174.19,
   "end": 177.19,
   "text": "На словах мне сказали обратиться в пироговку."
  },
  {
   "start": 177.19,
   "end": 180.19,
   "text": "Но, опять же, это ждать."
  },
  {
   "start": 180.19,
   "end": 182.19,
   "text": "Мне даже не дали направление туда."
  },
  {
   "start": 182.19,
   "end": 186.19,
   "text": "Просто сиди дома и жди, пока не станет хуже."
  },
  {
   "start": 186.19,
   "end": 188.19,
   "text": "Я не виню врачей, они часть системы."
  },
  {
   "start": 188.19,
   "end": 194.19,
   "text": "Только система, где 18-летняя девочка с двумя литрами в мочевом пузыре – это не наш профиль."
  },
  {
   "start": 194.19,
   "end": 202.19,
   "text": "Где проще сказать «это норма», когда все только начиналось, и, возможно, я бы ходила."
  },
  {
   "start": 202.19,
   "end": 204.19,
   "text": "Я не знаю, чем все это закончится."
  },
  {
   "start": 204.19,
   "end": 206.19,
   "text": "Но я знаю одно."
  },
  {
   "start": 206.19,
   "end": 209.19,
   "text": "Что я не сдамся, и я говорю это по 100 раз на день."
  },
  {
   "start": 209.19,
   "end": 210.19,
   "text": "Я буду ходить."
  },
  {
   "start": 210.19,
   "end": 212.19,
   "text": "Конечно, я буду ходить."
  },
  {
   "start": 212.19,
   "end": 214.19,
   "text": "Я буду ходить без палки."
  },
  {
   "start": 214.19,
   "end": 218.19,
   "text": "Но самое главное, что я сейчас буду говорить."
  },
  {
   "start": 218.19,
   "end": 222.19,
   "text": "Я буду говорить и много говорить, пока меня наконец не услышат."
  },
  {
   "start": 222.19,
   "end": 227.19,
   "text": "Потому что так жить в такой системе – это просто невозможно."
  }
 ]
}