{
 "clip_id": 57,
 "model": "faster-whisper large-v3",
 "language": "ru",
 "duration": 48.67,
 "segments": [
  {
   "start": 0.3,
   "end": 5.74,
   "text": "Долгожданный рецепт сырников без яиц. Обязательно прочтите рецепт под видео, чтобы у вас точно все получилось."
  },
  {
   "start": 5.98,
   "end": 9.7,
   "text": "Необходимо протереть творог через сито, чтобы он был более однородным."
  },
  {
   "start": 9.78,
   "end": 13.34,
   "text": "Есть второй способ, вот так вот промякать его руками и разбить все крупинки."
  },
  {
   "start": 13.42,
   "end": 17.8,
   "text": "Добавляем сахар и манку, и я все так же перемешиваю руками, чтобы объединить все ингредиенты."
  },
  {
   "start": 18.04,
   "end": 21.68,
   "text": "Консистенция теста должна быть такая, чтобы его можно было собрать в один комок."
  },
  {
   "start": 21.72,
   "end": 24.6,
   "text": "Оставляем тесто на 10-15 минут, чтобы манка набухла."
  },
  {
   "start": 24.7,
   "end": 29.02,
   "text": "Поверхность присыпаем манкой и катаем шарик, и с помощью ножа придаем форму сырника."
  },
  {
   "start": 29.02,
   "end": 33.28,
   "text": "В сковородку совсем немного смазываем растительным маслом и выкладываем сырники."
  },
  {
   "start": 33.38,
   "end": 36.06,
   "text": "Подальше друг от друга, чтобы их потом удобнее было переворачивать."
  },
  {
   "start": 36.14,
   "end": 39.92,
   "text": "Накрываем крышкой и жарим на самом маленьком огне с двух сторон до золотистой корочки."
  },
  {
   "start": 40.0,
   "end": 43.42,
   "text": "Я очень люблю сырники со сметаной, и смотрите, какие они получаются."
  },
  {
   "start": 43.64,
   "end": 46.8,
   "text": "Хрустящая корочка снаружи и нежный мягкий творог внутри."
  },
  {
   "start": 46.9,
   "end": 48.32,
   "text": "Попробуйте, приятного аппетита!"
  }
 ]
}