{
 "clip_id": 43,
 "model": "faster-whisper large-v3",
 "language": "ru",
 "duration": 176.01,
 "segments": [
  {
   "start": 0.0,
   "end": 3.76,
   "text": "Кажется, в Россию снова понемногу возвращается уличная политика."
  },
  {
   "start": 4.08,
   "end": 8.04,
   "text": "Сегодня, 4 октября, прошел митинг от КПРФ в Москве"
  },
  {
   "start": 8.04,
   "end": 10.06,
   "text": "к годовщине штурма Белого дома."
  },
  {
   "start": 30.0,
   "end": 32.06,
   "text": "Долой партию жуликов и воров!"
  },
  {
   "start": 34.82,
   "end": 37.28,
   "text": "Позже участники начали скандировать"
  },
  {
   "start": 37.28,
   "end": 41.18,
   "text": "«Свободу народу! Свободу политзаключенным! Долой царя!"
  },
  {
   "start": 41.28,
   "end": 44.9,
   "text": "Нет политическим репрессиям! И долой Роскомнадзор!»"
  },
  {
   "start": 44.9,
   "end": 47.96,
   "text": "А также «Долой партию жуликов и воров!»"
  },
  {
   "start": 47.96,
   "end": 51.7,
   "text": "Долой царя! Долой царя!"
  },
  {
   "start": 60.0,
   "end": 60.88,
   "text": "Позорники!"
  },
  {
   "start": 72.88,
   "end": 75.36,
   "text": "Он закон не нарушал!"
  },
  {
   "start": 75.84,
   "end": 77.5,
   "text": "Он закон не нарушал!"
  },
  {
   "start": 77.52,
   "end": 78.6,
   "text": "Отпустите их!"
  },
  {
   "start": 82.42,
   "end": 83.66,
   "text": "Отпустите их!"
  },
  {
   "start": 83.66,
   "end": 85.08,
   "text": "Отпустите их!"
  },
  {
   "start": 85.08,
   "end": 86.44,
   "text": "По команде сорвали!"
  },
  {
   "start": 87.16,
   "end": 88.34,
   "text": "Команда была!"
  },
  {
   "start": 89.62,
   "end": 89.66,
   "text": "Отпустите их!"
  },
  {
   "start": 89.66,
   "end": 89.76,
   "text": "Отпустите их!"
  },
  {
   "start": 89.76,
   "end": 89.78,
   "text": "Отпустите их!"
  },
  {
   "start": 89.78,
   "end": 89.8,
   "text": "Отпустите их!"
  },
  {
   "start": 89.8,
   "end": 89.82,
   "text": "Отпустите их!"
  },
  {
   "start": 89.82,
   "end": 89.84,
   "text": "Отпустите их!"
  },
  {
   "start": 89.84,
   "end": 89.94,
   "text": "Отпустите их!"
  },
  {
   "start": 89.94,
   "end": 89.96,
   "text": "Отпустите их!"
  },
  {
   "start": 89.96,
   "end": 89.98,
   "text": "Отпустите их!"
  },
  {
   "start": 89.98,
   "end": 90.0,
   "text": "Отпустите их!"
  },
  {
   "start": 90.0,
   "end": 106.16,
   "text": "В данный момент сообщается о 60 задержанных, а по оценкам очевидцев на акцию пришло около 2000 человек в Москве в 2026 году."
  },
  {
   "start": 106.16,
   "end": 113.66,
   "text": "Совсем недавно состоялись еще два митинга в других городах, в Сыктывкаре и в Тюмени, против фальсификации на выборах."
  },
  {
   "start": 113.66,
   "end": 122.88,
   "text": "И все эти истории с увеличением протестной активности интересны тем, что раньше наша система не могла себе этого позволить, но сейчас снова что-то изменилось."
  },
  {
   "start": 123.14,
   "end": 130.76,
   "text": "Где-то митинги стало проводить можно, где-то нет. Почти все не были согласованы или сначала согласованы, а потом отменены."
  },
  {
   "start": 130.76,
   "end": 135.44,
   "text": "А активисты, подававшие заявки, так или иначе сталкивались с репрессиями."
  },
  {
   "start": 135.5,
   "end": 143.04,
   "text": "Это все очень похоже на дисфункциональность управления, когда сначала, как говорила Екатерина Шульман, принимается решение А,"
  },
  {
   "start": 143.52,
   "end": 143.64,
   "text": "а потом, как говорится, принимается решение В."
  },
  {
   "start": 143.64,
   "end": 145.22,
   "text": "А потом решение минус А."
  },
  {
   "start": 145.54,
   "end": 154.5,
   "text": "Система принятия решений в таком состоянии, что она может принять решение А, потом кто-то прибежал, напугал, повлиял, и она принимает решение минус А."
  },
  {
   "start": 155.68,
   "end": 158.42,
   "text": "Раньше такого не было. Как говорится, при Путине порядок был."
  },
  {
   "start": 158.7,
   "end": 162.62,
   "text": "Обратим внимание на этот признак очевидной дисфункциональности."
  },
  {
   "start": 163.14,
   "end": 167.04,
   "text": "И самый яркий пример тому это снятие федерального списка яблока с выборов."
  },
  {
   "start": 167.04,
   "end": 169.34,
   "text": "Оно было допущено чисто по инерции."
  },
  {
   "start": 169.66,
   "end": 173.24,
   "text": "Но когда партия с лозунгом «За мир и свободу» стала резко набирать популярность,"
  },
  {
   "start": 173.24,
   "end": 175.56,
   "text": "начальство испугалось."
  }
 ]
}