{
 "clip_id": 3,
 "model": "faster-whisper large-v3",
 "language": "ru",
 "duration": 152.32,
 "segments": [
  {
   "start": 0.05,
   "end": 27.83,
   "text": "Я хочу обсудить одну тему, социокультурный феномен под названием мужчины и еда, и я не про то, что они много едят, на это тащим-то похуй, я скорее про то, что они, то есть вот у них нету этого деликатного понимания и уважительного отношения к потребностям других, я скажу так, да, и любая женщина, девушка или девочка, которая посмотрела видео досюда, она уже понимает, о чем я, потому что мой опыт, он не уникален,"
  },
  {
   "start": 27.83,
   "end": 46.43,
   "text": "это абсолютно универсальная женская история, я испытывала это, и я страдала от этого, когда я жила в семье, да, с отцом, с младшим братом, потом, когда я жила с парнями, все, все вели себя одинаково в этих вопросах, кто-то хуже, кто-то лучше, но это было абсолютно невыносимо, а было это так,"
  },
  {
   "start": 46.43,
   "end": 57.51,
   "text": "они хотели жрать, и они сжирали все, последнюю порцию, или, например, три четвертых лазаней, которая могла бы быть еще разделена,"
  },
  {
   "start": 57.83,
   "end": 70.07,
   "text": "я не знаю, еще два, например, вечера могла бы быть съедена или съедаться, да, и на вопрос, а что ты мне не оставил, всегда круглые глаза, и, а я не знаю, что ты хочешь,"
  },
  {
   "start": 70.49,
   "end": 85.15,
   "text": "надо сначала спросить, чтобы понять, что я не хочу, и, вы знаете, я потом уехала в общагу, и там были тоже разные кадры, и бывало и классное, бывало и пиздец, как когда-нибудь я расскажу историю про Зухру,"
  },
  {
   "start": 85.15,
   "end": 87.81,
   "text": "это вообще полный отстой, и тот еще."
  },
  {
   "start": 87.83,
   "end": 98.49,
   "text": "Трешнячок, но у меня никогда не возникало проблем с женщинами в вопросах еды, а мы готовили вместе в общаге, мы вместе жили, то есть у меня с некоторыми были очень близкие отношения,"
  },
  {
   "start": 98.49,
   "end": 115.53,
   "text": "и после универа я, например, два года жила со своей лучшей подругой, причем это были, знаете, не такие сожительские, так сказать, отношения, где вот это моя полочка с продуктиками, а это твоя полочка с продуктиками, мы по факту жили в бостонском браке, у нас было общее все, кроме трусов,"
  },
  {
   "start": 116.57,
   "end": 117.09,
   "text": "и,"
  },
  {
   "start": 117.09,
   "end": 129.97,
   "text": "не раз, чтобы Аня съела что-то, что мы могли бы разделить вместе вечером на ужин, да никогда, и, вы знаете, я в каком-то смысле даже завидую вот этой вот беззаветной возможности, да, насрать на все, и вот"
  },
  {
   "start": 129.97,
   "end": 146.97,
   "text": "вот все, что вижу, кладу в рот, а мне похуй, голодный ты, не голодный ты, есть ли тебе что пожрать, когда ты придешь с работы, я хочу есть, и я ем, но вот, вот я женщина, и, к сожалению, женская гендерная социализация работает,"
  },
  {
   "start": 147.09,
   "end": 148.13,
   "text": "тут для меня по-другому."
  }
 ]
}