{
 "clip_id": 76,
 "model": "faster-whisper large-v3",
 "language": "ru",
 "duration": 50.65,
 "segments": [
  {
   "start": 0.0,
   "end": 4.6,
   "text": "Вход через госуслуги, что изменится осенью 2026 года."
  },
  {
   "start": 4.84,
   "end": 11.14,
   "text": "Новость о том, что интернет в России станет доступен исключительно по паспорту, взорвала информационное пространство."
  },
  {
   "start": 11.5,
   "end": 15.9,
   "text": "Заголовки кричат «Анонимность уничтожена», «Фейковые страницы запретят»,"
  },
  {
   "start": 15.9,
   "end": 20.58,
   "text": "а каждый лайк или комментарий будет привязан к вашему реальному имени через госуслуги."
  },
  {
   "start": 20.98,
   "end": 25.2,
   "text": "Естественно, никто не хочет оставлять свои паспортные данные на каждом развлекательном сайте."
  },
  {
   "start": 25.2,
   "end": 30.66,
   "text": "Государства и крупные IT-корпорации планомерно усиливают контроль, но делают они это точечно."
  },
  {
   "start": 31.02,
   "end": 35.54,
   "text": "Там, где крутятся реальные деньги и там, где люди активно взаимодействуют друг с другом."
  },
  {
   "start": 35.64,
   "end": 39.84,
   "text": "Мессенджеры, крупные социальные сети, финансовые платформы, сервисы объявлений."
  },
  {
   "start": 40.12,
   "end": 43.5,
   "text": "Вот здесь подтверждение личности станет неизбежным."
  },
  {
   "start": 43.72,
   "end": 47.24,
   "text": "Хотите избавиться законно от кредитов и долгов через суд?"
  },
  {
   "start": 47.6,
   "end": 50.44,
   "text": "Записывайтесь на бесплатный анализ по ссылке в комментариях."
  }
 ]
}